<?xml version="1.0" encoding="UTF-8"?>
<alphabetRules xmlns="http://ganzua.sourceforge.net/rules"
               xmlns:xsi="http://www.w3.org/2001/XMLSchema-instance"
               xsi:schemaLocation="http://ganzua.sourceforge.net/rules
                                   ../schemata/AlphabetRules.xsd"
               language="en" country="GB"
               source="/home/user/examples/en/cprfd10.txt" 
               sourceEncoding="US-ASCII">
 <include>
  <character char="a" />
  <character char="b" />
  <character char="c" />
  <character char="d" />
  <character char="e" />
  <character char="f" />
  <character char="g" />
  <character char="h" />
  <character char="i" />
  <character char="j" />
  <character char="k" />
  <character char="l" />
  <character char="m" />
  <character char="n" />
  <character char="o" />
  <character char="p" />
  <character char="q" />
  <character char="r" />
  <character char="s" />
  <character char="t" />
  <character char="u" />
  <character char="v" />
  <character char="w" />
  <character char="x" />
  <character char="y" />
  <character char="z" />
 </include>
 <ignore>
  <character char=" " />
  <character char="&#9;" />  <!-- horizontal tab Unicode character reference-->
  <character char="&#10;" /> <!-- line feed -->
  <character char="&#13;" /> <!-- carriage return -->
  <character char="&#13;&#10;" /> <!-- new line -->
  <character char="-" />
  <character char="," />
  <character char=";" />
  <character char=":" />
  <character char="!" />
  <character char="?" />
  <character char="/" />
  <character char="." />
  <character char="&apos;" />
  <character char="&quot;" />
  <character char="(" />
  <character char=")" />
  <character char="&amp;" />
  <character char="0" />
  <character char="1" />
  <character char="2" />
  <character char="3" />
  <character char="4" />
  <character char="5" />
  <character char="6" />
  <character char="7" />
  <character char="8" />
  <character char="9" />
 </ignore>
 <replace>
  <occurrences ofChar="A" byChar="a" />
  <occurrences ofChar="B" byChar="b" />
  <occurrences ofChar="C" byChar="c" />
  <occurrences ofChar="D" byChar="d" />
  <occurrences ofChar="E" byChar="e" />
  <occurrences ofChar="F" byChar="f" />
  <occurrences ofChar="G" byChar="g" />
  <occurrences ofChar="H" byChar="h" />
  <occurrences ofChar="I" byChar="i" />
  <occurrences ofChar="J" byChar="j" />
  <occurrences ofChar="K" byChar="k" />
  <occurrences ofChar="L" byChar="l" />
  <occurrences ofChar="M" byChar="m" />
  <occurrences ofChar="N" byChar="n" />
  <occurrences ofChar="O" byChar="o" />
  <occurrences ofChar="P" byChar="p" />
  <occurrences ofChar="Q" byChar="q" />
  <occurrences ofChar="R" byChar="r" />
  <occurrences ofChar="S" byChar="s" />
  <occurrences ofChar="T" byChar="t" />
  <occurrences ofChar="U" byChar="u" />
  <occurrences ofChar="V" byChar="v" />
  <occurrences ofChar="W" byChar="w" />
  <occurrences ofChar="X" byChar="x" />
  <occurrences ofChar="Y" byChar="y" />
  <occurrences ofChar="Z" byChar="z" />
 </replace>
</alphabetRules>
